<?xml version="1.0" encoding="UTF-8" ?>
<admins     xmlns:xsi = "http://www.w3.org/2001/XMLSchema-instance"
            xmlns="http://it-academy.by/it/subach/jd02_07/admins"
            xsi:schemaLocation="http://it-academy.by/it/subach/jd02_07/admins admins.xsd"
>
    <admin>
        <login>Alfons</login>
        <email>alfons@gmail.com</email>
        <password>123456</password>
    </admin>

    <admin>
        <login>Andrey</login>
        <email>andrey@gmail.com</email>
        <password>qwerty</password>
    </admin>

</admins>